{"deliverable_created":{"component_tree":[{"allowed_variants":["supplied_count"],"blocked_variants":["invent_count"],"color_tokens":{"mode":"PRESERVE_EXISTING"},"component_id":"results_summary","component_type":"SUMMARY","content":{"count":6,"label":"cargas encontradas"},"role":"represent supplied result count","spacing":{"mode":"PRESERVE_EXISTING"},"state":{"total_records":6},"typography":{"mode":"PRESERVE_EXISTING"},"visual_priority":3,"zone_id":"results"},{"allowed_variants":["existing_value"],"blocked_variants":["invent_page_size"],"color_tokens":{"mode":"PRESERVE_EXISTING"},"component_id":"rows_per_page","component_type":"PAGE_SIZE_CONTROL","content":{"label":"registros por página","observed_value":25},"role":"represent supplied page size","spacing":{"mode":"PRESERVE_EXISTING"},"state":{"page_size":25},"typography":{"mode":"PRESERVE_EXISTING"},"visual_priority":3,"zone_id":"pagination"},{"allowed_variants":["state_derived_pages"],"blocked_variants":["phantom_pages","prebound_current_page"],"color_tokens":{"mode":"PRESERVE_EXISTING"},"component_id":"pagination","component_type":"PAGINATION","content":{"observed_next":"visible","observed_pages":[1,2,3]},"role":"remove unsupported page destinations without prebinding current page","spacing":{"mode":"PRESERVE_EXISTING"},"state":{"rule_status":"PROPOSED_NOT_CANONICAL","selected_page_source":"READ_LIVE_COMPONENT_STATE_NOT_PREBOUND"},"typography":{"mode":"PRESERVE_EXISTING"},"visual_priority":3,"zone_id":"pagination"},{"allowed_variants":["horizontal_overflow_when_required"],"blocked_variants":["drop_column","drop_action","rename_supplied_header"],"color_tokens":{"mode":"PRESERVE_EXISTING"},"component_id":"history_table","component_type":"DATA_TABLE","content":{"headers":["Fecha de carga","Archivo","Tipo","Registros","Válidos","Con error","Estado","Usuario","Fecha de proceso","Acciones"],"visible_rows":6},"role":"preserve every supplied column and row action","spacing":{"mode":"PRESERVE_EXISTING"},"state":{"all_supplied_columns_reachable":true},"typography":{"mode":"PRESERVE_EXISTING"},"visual_priority":5,"zone_id":"results"},{"allowed_variants":["overflow_auto"],"blocked_variants":["remove_real_overflow_access","drop_column_to_fit"],"color_tokens":{"mode":"PRESERVE_EXISTING"},"component_id":"table_horizontal_scroll","component_type":"OVERFLOW_CONTROL","content":{"observed":"scrollbar chrome visible while all ten supplied headers fit viewport"},"role":"provide horizontal access only under measured overflow","spacing":{"mode":"PRESERVE_EXISTING"},"state":{"target_policy":"conditional_on_measured_overflow"},"typography":{"mode":"PRESERVE_EXISTING"},"visual_priority":1,"zone_id":"results"}],"density_rules":["Preserve all ten supplied table headers and row actions.","Do not trade information completeness for narrower layout."],"governance_context":{"adapter_code":"ADAPTER-LF-SHELL-PROFILE-20260827","adapter_policy":"v0.1 / assurance v2 / ROUTER_BOUND_ONLY / exactly one invocation / NO_SECOND_LLM_CALL","card_id":"CARD_MARKETPLACE_LF_DECISIONES_PRODUCTO_EXPERIENCIA_v0.1_CANDIDATO","card_sections":["Role","Decision lenses","Hard blockers"],"execution_contract_sha256":"b292a88f133937865881ad97a94c939bf7be9b64b9a87090b111db23c987c563","execution_id":"EXEC-S26-N08E-GPT-NATIVE-GOLDEN-E-001","input_governance_ref":"programacion.input_readiness_runs/221","prebound_commit_sha":"be81529076840bd73c1a883ee504f929760c6906","render_policy":"NON_RENDER","source_refs":{"adapter_binding":"github://cristhianlujan/claude-persona-lf-patch@be81529076840bd73c1a883ee504f929760c6906/sandbox/lf_contract_gate_test/profile_execution_runtime/evidence/s26_native_golden_005/router_adapter_binding_snapshot.json","adapter_capsule":"github://cristhianlujan/claude-persona-lf-patch@be81529076840bd73c1a883ee504f929760c6906/adapters/lf_shell_profile_adapter/runtime/runtime_capsule.yaml","card":"github://cristhianlujan/claude-persona-lf-patch@be81529076840bd73c1a883ee504f929760c6906/cards/marketplace_lf/decision_product_experience/CARD.md","input":"github://cristhianlujan/claude-persona-lf-patch@be81529076840bd73c1a883ee504f929760c6906/sandbox/lf_contract_gate_test/profile_execution_runtime/evidence/s26_native_golden_005/input.txt","input_governance":"github://cristhianlujan/claude-persona-lf-patch@be81529076840bd73c1a883ee504f929760c6906/sandbox/lf_contract_gate_test/profile_execution_runtime/evidence/s26_native_golden_005/input_governance_snapshot.json","observation_packet":"github://cristhianlujan/claude-persona-lf-patch@be81529076840bd73c1a883ee504f929760c6906/sandbox/lf_contract_gate_test/profile_execution_runtime/evidence/s26_native_golden_005/visual_observation_packet.json"}},"layout_grid":{"content":"preserve supplied desktop composition","shell":"locked; not modified","table":"use available width; horizontal access only under real overflow"},"prompt_constraints":["Execution facts resolve only from immutable prebound commit be81529076840bd73c1a883ee504f929760c6906.","Observation authority: github://cristhianlujan/claude-persona-lf-patch@be81529076840bd73c1a883ee504f929760c6906/sandbox/lf_contract_gate_test/profile_execution_runtime/evidence/s26_native_golden_005/visual_observation_packet.json.","Input authority: github://cristhianlujan/claude-persona-lf-patch@be81529076840bd73c1a883ee504f929760c6906/sandbox/lf_contract_gate_test/profile_execution_runtime/evidence/s26_native_golden_005/input.txt.","Input Governance: github://cristhianlujan/claude-persona-lf-patch@be81529076840bd73c1a883ee504f929760c6906/sandbox/lf_contract_gate_test/profile_execution_runtime/evidence/s26_native_golden_005/input_governance_snapshot.json.","Card authority: github://cristhianlujan/claude-persona-lf-patch@be81529076840bd73c1a883ee504f929760c6906/cards/marketplace_lf/decision_product_experience/CARD.md.","Adapter binding: github://cristhianlujan/claude-persona-lf-patch@be81529076840bd73c1a883ee504f929760c6906/sandbox/lf_contract_gate_test/profile_execution_runtime/evidence/s26_native_golden_005/router_adapter_binding_snapshot.json.","Governance metadata is non-render.","Prior Run D score/verdict is not authority."],"remediation_actions":[{"acceptance_check":{"check_type":"STATE","expected":"6 records / 25 per page => one valid page destination, next disabled, no prebound current_page","target_component_id":"pagination"},"acceptance_criteria":"For supplied total_records=6 and page_size=25, pagination exposes one valid page destination and next is disabled; no current_page value is prebound.","category":"INTERACTION","decision":"Set pagination state from supplied total_records and page_size, reading selected page from live component state and exposing no page beyond the derived count.","evidence_anchor":"Supplied packet: 6 cargas encontradas and 25 registros por página while pagination exposes pages 1, 2, 3 plus next.","evidence_component_ids":["results_summary","rows_per_page","pagination"],"execution":{"desired_value":"page_count=max(1,ceil(total_records/page_size)); available_pages=1..page_count; selected_page=read_live_state(); next_enabled=selected_page<page_count","operation":"SET_STATE","property":"available_pages_and_next_state","target_component_id":"pagination"},"implementation_change":"Set pagination page_count=max(1,ceil(total_records/page_size)); generate available pages from page_count; read selected_page from live pagination state; disable next when selected_page is not below page_count.","issue_id":"B2B-CARGA-PAGINATION-E-001","precision_basis":{"mode":"RELATIVE_GUIDANCE","proposal_status":"PROPOSED_NOT_CANONICAL","source_refs":["github://cristhianlujan/claude-persona-lf-patch@be81529076840bd73c1a883ee504f929760c6906/sandbox/lf_contract_gate_test/profile_execution_runtime/evidence/s26_native_golden_005/input.txt","github://cristhianlujan/claude-persona-lf-patch@be81529076840bd73c1a883ee504f929760c6906/sandbox/lf_contract_gate_test/profile_execution_runtime/evidence/s26_native_golden_005/visual_observation_packet.json"],"value_or_rule":"derive page count/destinations from supplied total_records and page_size; selected_page remains live state"},"priority":"P1","semantic_authority":{"authority_type":"RAW_INPUT","claim_boundary":"Sources authorize the supplied count/page-size/pagination inconsistency only; the formula is producer guidance, not upstream/canonical authority, and current_page is not supplied.","source_refs":["github://cristhianlujan/claude-persona-lf-patch@be81529076840bd73c1a883ee504f929760c6906/sandbox/lf_contract_gate_test/profile_execution_runtime/evidence/s26_native_golden_005/input.txt","github://cristhianlujan/claude-persona-lf-patch@be81529076840bd73c1a883ee504f929760c6906/sandbox/lf_contract_gate_test/profile_execution_runtime/evidence/s26_native_golden_005/visual_observation_packet.json"]}},{"acceptance_check":{"check_type":"STATE","expected":"hidden without measured overflow; available under actual overflow","target_component_id":"table_horizontal_scroll"},"acceptance_criteria":"Table QA shows no horizontal-scroll chrome when columns fit; under real overflow, horizontal access remains and every supplied header/action is reachable.","category":"HIERARCHY","decision":"Hide table horizontal scroll chrome when there is no measured overflow while preserving horizontal access whenever the table exceeds its container.","evidence_anchor":"Supplied packet: horizontal scrollbar chrome is visible while all ten supplied headers including Acciones fit the 1600px viewport.","evidence_component_ids":["history_table","table_horizontal_scroll"],"execution":{"desired_value":"hidden when scrollWidth <= clientWidth; horizontal access retained when scrollWidth > clientWidth","operation":"HIDE","property":"visibility_when_no_overflow","target_component_id":"table_horizontal_scroll"},"implementation_change":"Hide table_horizontal_scroll when scrollWidth <= clientWidth and retain overflow-x:auto when scrollWidth > clientWidth; preserve every supplied header and action.","issue_id":"B2B-CARGA-OVERFLOW-E-001"